{
  "definitions": {},
  "$schema": "http://json-schema.org/draft-07/schema#",
  "$id": "https://example.com/object1659129904.json",
  "title": "Root",
  "type": "object",
  "required": ["data", "updatedAt"],
  "properties": {
    "title": {
      "$id": "#root/title",
      "title": "Title",
      "type": "string",
      "default": ""
    },
    "id": {
      "$id": "#root/id",
      "title": "Id",
      "type": "string",
      "default": ""
    },
    "data": {
      "$id": "#root/data",
      "title": "Data",
      "type": "array",
      "default": [],
      "items": {
        "$id": "#root/data/items",
        "title": "Items",
        "type": "object",
        "properties": {
          "question": {
            "$id": "#root/data/items/question",
            "title": "Question",
            "type": "string",
            "default": ""
          },
          "id": {
            "$id": "#root/data/items/id",
            "title": "Id",
            "type": "integer",
            "default": 0
          },
          "numberOfComments": {
            "$id": "#root/data/items/numberOfComments",
            "title": "Numberofcomments",
            "type": "integer",
            "default": 0
          },
          "answers": {
            "$id": "#root/data/items/answers",
            "title": "Answers",
            "type": "array",
            "default": [],
            "items": {
              "$id": "#root/data/items/answers/items",
              "title": "Items",
              "type": "object",
              "required": ["answer", "correct"],
              "properties": {
                "answer": {
                  "$id": "#root/data/items/answers/items/answer",
                  "title": "Answer",
                  "type": "string",
                  "default": ""
                },
                "correct": {
                  "$id": "#root/data/items/answers/items/correct",
                  "title": "Correct",
                  "type": "boolean",
                  "default": true
                }
              }
            }
          },
          "comments": {
            "type": "array",
            "items": {
              "type": "object",
              "properties": {
                "author": {
                  "type": "string"
                },
                "comment": {
                  "type": "string"
                },
                "date": {
                  "type": "string",
                  "pattern": "^[0-9]{2}-[0-9]{2}-[0-9]{4} [0-9]{2}:[0-9]{2}:[0-9]{2}$"
                }
              },
              "required": ["author", "comment", "date"]
            }
          },
          "contributors": {
            "$id": "#root/data/items/contributors",
            "title": "Contributors",
            "type": "array",
            "items": {
              "type": "string"
            }
          }
        }
      }
    },
    "updatedAt": {
      "$id": "#root/updatedAt",
      "title": "Updatedat",
      "type": "integer",
      "default": 0
    }
  }
}
